{
  "contractVersion": "trustgate-verified-person.v1",
  "provider": "trustgate-demo-adapter",
  "providerSubject": "TRUSTGATE-DEMO-7841988",
  "accountLevel": "SOP3",
  "verifiedAt": "2026-05-29T17:20:00+04:00",
  "claims": {
    "fullName": "Aisha Al Mansoori",
    "fullNameAr": "عائشة المنصوري",
    "emiratesIdMasked": "784-1988-XXXXXXX-1",
    "mobileMasked": "+971 50 XXX 2184",
    "emailMasked": "a.almansoori@example.ae",
    "nationality": "United Arab Emirates",
    "nationalityAr": "الإمارات العربية المتحدة"
  },
  "availableData": [
    "fullName",
    "fullNameAr",
    "emiratesIdMasked",
    "mobileMasked",
    "emailMasked",
    "nationality"
  ],
  "missingData": [
    "currentSalary",
    "remarks",
    "requiredDocuments",
    "financialObligations"
  ]
}
